Orgánica;Económica;Explicación;Total (miles euros);Total (euros)
28.50;74913;Al CDTI para las ayudas NEOTEC. Mecanismo de Recuperación y Resiliencia;35.000,00;35.000.000,00
28.50;74917;Al CDTI para ayudas a Ecosistemas de innovación basados en las Redes de Excelencia Cervera. MRR;6.680,00;6.680.000,00
—;—;TOTAL MECANISMO DE RECUPERACIÓN Y RESILIENCIA;41.680,00;41.680.000,00
28.301;—;Consejo Superior de Investigaciones Científicas (CSIC) – Transferencia de conocimiento;268,01;268.010,00
—;—;TOTAL PROGRAMA C17.I05;41.948,01;41.948.010,00
