Clasificación por programas;Explicación;Cap. 1;Cap. 2;Cap. 3;Cap. 4;Cap. 6;Cap. 7;Cap. 8;Cap. 1 a 8;Cap. 9;Total (miles euros);Total (euros)
26BA;C02.I01 Rehabilitación en entornos residenciales;—;—;—;—;880.000,00;1.100.000,00;—;1.980.000,00;—;1.980.000,00;1.980.000.000,00
26BB;C02.I02 Viviendas en alquiler social eficientes;—;—;—;—;500.000,00;—;—;500.000,00;—;500.000,00;500.000.000,00
261M;Dirección y Servicios Generales;3.969,00;285;—;—;—;—;—;4.254,00;—;4.254,00;4.254.000,00
261N;Promoción, administración y ayudas para rehabilitación y acceso a vivienda;2.182,33;241,3;1.630,00;3.000,00;350;691.948,12;260.000,00;959.351,75;165;959.516,75;959.516.750,00
261O;Ordenación y fomento de la edificación;1.777,12;972,25;—;300;24.450,00;2.942,45;—;30.441,82;—;30.441,82;30.441.820,00
261P;Urbanismo y política del suelo;834,24;374;—;105;383,84;5.025,00;—;6.722,08;—;6.722,08;6.722.080,00
TOTAL CONSOLIDADO;;8.762,69;1.872,55;1.630,00;3.405,00;25.183,84;2.079.915,57;1.360.000,00;3.480.769,65;165;3.480.934,65;3.480.934.650,00
000X;Transferencias y libramientos internos;—;—;—;—;—;900;—;900;—;900;900.000,00
TOTAL GENERAL;;8.762,69;1.872,55;1.630,00;3.405,00;25.183,84;2.080.815,57;1.360.000,00;3.481.669,65;165;3.481.834,65;3.481.834.650,00
