Clasificación por programas;Explicación;Cap. 1 ;Cap. 4 ;Cap. 1 a 8 ;Total (miles Euros);Total (euros)
923S;Aportaciones al Mutualismo Administrativo;2.281.136,60;—;2.281.136,60;2.281.136,60;2.281.136.600,00
—;TOTAL CONSOLIDADO;—;—;2.281.136,60;2.281.136,60;2.281.136.600,00
000X;Transferencias y libramientos internos;—;98.330,95;98.330,95;98.330,95;98.330.950,00
—;TOTAL TRANSFERENCIAS ENTRE SUBSECTORES;—;—;98.330,95;98.330,95;98.330.950,00
—;TOTAL GENERAL SECCIÓN 09;—;—;2.379.467,55;2.379.467,55;2.379.467.550,00
