;PRESUPUESTOS GENERALES DEL ESTADO;
;ORGANISMOS AUT흁OMOS;
;Resumen general por organismos y cap狎ulos del presupuesto de gastos;
;PRESUPUESTO 2023-P;
;
;(Miles de euros);
;
Org烱ica;Explicaci蚤;Cap. 1;Cap. 2;Cap. 3;Cap. 4;Cap. 6;Cap. 7;Cap. 8;Cap. 9;Total;
13;MINISTERIO DE LA PRESIDENCIA, JUSTICIA Y RELACIONES CON LAS CORTES;83.814,13;136.606,31;30,57;48.967,54;43.848,95;500,00;484,44;60,00;314.311,94;
13.101; CENTRO DE ESTUDIOS JUR펛ICOS;9.240,68;4.965,49;5,00;5.274,91;777,00;;4,07;;20.267,15;
13.102; MUTUALIDAD GENERAL JUDICIAL;6.272,16;79.219,62;0,57;42.054,99;614,67;;10,82;;128.172,83;
13.103; CENTRO DE ESTUDIOS POL펪ICOS Y CONSTITUCIONALES;2.618,31;1.424,20;;166,10;300,00;;10,03;;4.518,64;
13.104; CENTRO DE INVESTIGACIONES SOCIOL휺ICAS;4.771,20;6.582,89;;258,00;1.035,00;;12,02;;12.659,11;
13.105; CONSEJO DE ADMINISTRACI흁 DEL PATRIMONIO NACIONAL;60.911,78;44.414,11;25,00;1.213,54;41.122,28;500,00;447,50;60,00;148.694,21;
14;MINISTERIO DE DEFENSA;114.784,16;648.947,00;383,01;314.795,49;209.764,72;100,00;578,20;252,00;1.289.604,58;
14.101; INSTITUTO NACIONAL DE T텎NICA AEROESPACIAL ESTEBAN TERRADAS;78.288,35;56.399,13;310,00;1.669,78;58.852,14;;250,00;250,00;196.019,40;
14.107; INSTITUTO DE VIVIENDA, INFRAESTRUCTURA Y EQUIPAMIENTO DE LA DEFENSA;14.568,44;34.940,25;70,00;55.388,25;149.912,25;100,00;130,00;;255.109,19;
14.113; INSTITUTO SOCIAL DE LAS FUERZAS ARMADAS;21.927,37;557.607,62;3,01;257.737,46;1.000,33;;198,20;2,00;838.475,99;
15;MINISTERIO DE HACIENDA;66.226,29;20.987,36;121,90;21.849,85;3.920,57;;173,00;;113.278,97;
15.101; INSTITUTO DE ESTUDIOS FISCALES;20.907,73;11.760,93;6,75;396,19;1.430,00;;71,48;;34.573,08;
15.104; COMISIONADO PARA EL MERCADO DE TABACOS;3.193,99;4.443,20;90,15;21.453,66;990,57;;;;30.171,57;
15.107; PARQUE M흈IL DEL ESTADO;42.124,57;4.783,23;25,00;;1.500,00;;101,52;;48.534,32;
16;MINISTERIO DEL INTERIOR;533.497,39;199.716,04;52,89;136.826,82;126.511,31;2.000,00;608,31;;999.212,76;
16.101; JEFATURA CENTRAL DE TR첹ICO;530.803,08;196.404,61;52,89;136.826,82;115.161,31;;598,31;;979.847,02;
16.102; GERENCIA DE INFRAESTRUCTURAS Y EQUIPAMIENTO DE LA SEGURIDAD DEL ESTADO;1.772,21;483,53;;;11.100,00;2.000,00;10,00;;15.365,74;
16.103; CENTRO UNIVERSITARIO DE FORMACI흁 DE LA POLIC페 NACIONAL;922,10;2.827,90;;;250,00;;;;4.000,00;
17;MINISTERIO DE TRANSPORTES Y MOVILIDAD SOSTENIBLE;24.048,35;8.702,38;12,78;360,72;14.583,83;;38,32;27,60;47.773,98;
17.101; CENTRO DE ESTUDIOS Y EXPERIMENTACI흁 DE OBRAS P２LICAS;21.118,43;6.179,08;;319,72;6.744,47;;38,32;;34.400,02;
17.102; CENTRO NACIONAL DE INFORMACI흁 GEOGR첹ICA;2.929,92;2.523,30;12,78;41,00;7.839,36;;;27,60;13.373,96;
18;MINISTERIO DE EDUCACI흁, FORMACI흁 PROFESIONAL Y DEPORTES;13.155,23;63.937,85;160,00;202.539,22;31.769,63;72.127,66;642,51;;384.332,10;
18.106; CONSEJO SUPERIOR DE DEPORTES;13.155,23;63.937,85;160,00;202.539,22;31.769,63;72.127,66;642,51;;384.332,10;
19;MINISTERIO DE TRABAJO Y ECONOM페 SOCIAL;578.363,88;136.336,14;442,46;28.133.349,67;19.028,55;678,89;1.103,19;;28.869.302,78;
19.101; SERVICIO P２LICO DE EMPLEO ESTATAL;371.388,73;76.931,47;239,76;27.306.668,43;11.914,32;678,89;794,00;;27.768.615,60;
19.102; FONDO DE GARANT페 SALARIAL;18.630,43;9.553,16;202,24;800.053,23;1.467,50;;147,12;;830.053,68;
19.103; ORGANISMO ESTATAL INSPECCI흁 DE TRABAJO Y SEGURIDAD SOCIAL;169.053,15;29.710,60;;;4.291,73;;75,36;;203.130,84;
19.104; INSTITUTO NACIONAL DE SEGURIDAD Y SALUD EN EL TRABAJO, O.A., M.P.;19.291,57;20.140,91;0,46;26.628,01;1.355,00;;86,71;;67.502,66;
20;MINISTERIO DE INDUSTRIA Y TURISMO;50.772,14;26.344,70;155,24;10.997,13;97.554,89;;215,76;;186.039,86;
20.102; OFICINA ESPA헲LA DE PATENTES Y MARCAS;23.690,00;11.111,74;27,36;9.393,17;9.945,00;;73,75;;54.241,02;
20.103; CENTRO ESPA헲L DE METROLOG페;3.870,01;2.942,02;0,88;252,62;10.408,91;;7,65;;17.482,09;
20.104; INSTITUTO DE TURISMO DE ESPA헤;23.212,13;12.290,94;127,00;1.351,34;77.200,98;;134,36;;114.316,75;
21;MINISTERIO DE AGRICULTURA, PESCA Y ALIMENTACI흁;18.502,33;12.793,99;15,00;6.012.064,29;36.350,11;1.609.487,01;135,49;;7.689.348,22;
21.101; AGENCIA DE INFORMACI흁 Y CONTROL ALIMENTARIOS;4.092,10;3.656,05;;;1.540,00;;17,33;;9.305,48;
21.102; ENTIDAD ESTATAL DE SEGUROS AGRARIOS;2.205,96;1.277,29;15,00;318.855,15;601,24;;18,16;;322.972,80;
21.103; FONDO ESPA헲L DE GARANT페 AGRARIA;12.204,27;7.860,65;;5.693.209,14;34.208,87;1.609.487,01;100,00;;7.357.069,94;
23;MINISTERIO PARA LA TRANSICI흁 ECOL휺ICA Y EL RETO DEMOGR첹ICO;181.833,03;457.440,79;4.028,53;158.297,53;519.607,98;358.029,88;1.675,11;35.500,00;1.716.412,85;
23.101; PARQUES NACIONALES;9.366,42;13.473,79;15,50;1.055,52;133.143,11;4.772,41;15,00;;161.841,75;
23.102; CONFEDERACI흁 HIDROGR첹ICA DEL CANT첵RICO;9.657,55;3.500,00;47,00;151,00;12.000,00;;30,00;;25.385,55;
23.103; CONFEDERACI흁 HIDROGR첹ICA DEL DUERO;19.669,27;30.961,73;781,33;30,56;44.952,00;;100,00;;96.494,89;
23.104; CONFEDERACI흁 HIDROGR첹ICA DEL EBRO;32.150,37;38.612,50;18,50;815,52;37.905,00;100,00;45,00;;109.646,89;
23.105; CONFEDERACI흁 HIDROGR첹ICA DEL GUADALQUIVIR;24.458,45;61.592,26;250,00;1.035,53;88.358,57;13.200,00;162,04;35.500,00;224.556,85;
23.106; CONFEDERACI흁 HIDROGR첹ICA DEL GUADIANA;18.692,82;15.375,23;50,00;;31.300,00;1.000,00;47,92;;66.465,97;
23.107; CONFEDERACI흁 HIDROGR첹ICA DEL J３AR;15.434,31;18.416,30;600,00;156,36;19.000,00;435,00;35,00;;54.076,97;
23.108; CONFEDERACI흁 HIDROGR첹ICA DEL MI헲-SIL;6.243,29;11.048,86;20,00;40,43;30.740,00;50,00;20,00;;48.162,58;
23.109; CONFEDERACI흁 HIDROGR첹ICA DEL SEGURA;12.181,14;67.514,80;126,76;2.860,77;18.199,33;15.623,55;65,15;;116.571,50;
23.110; CONFEDERACI흁 HIDROGR첹ICA DEL TAJO;18.277,92;17.867,05;570,00;48,02;31.813,30;670,00;25,00;;69.271,29;
23.111; MANCOMUNIDAD DE LOS CANALES DEL TAIBILLA;13.348,00;171.005,13;620,00;113,04;54.846,67;1.500,00;1.120,00;;242.552,84;
23.112; INSTITUTO PARA LA TRANSICI흁 JUSTA;2.353,49;8.073,14;929,44;151.990,78;17.350,00;320.678,92;10,00;;501.385,77;
24;MINISTERIO DE CULTURA;86.899,95;75.412,73;127,48;209.293,15;114.326,78;7.631,00;575,72;;494.266,81;
24.103; INSTITUTO DE LA CINEMATOGRAF페 Y DE LAS ARTES AUDIOVISUALES;8.549,22;4.854,85;40,00;153.721,17;835,00;30,00;54,00;;168.084,24;
24.104; BIBLIOTECA NACIONAL DE ESPA헤;17.226,78;10.262,95;;661,17;6.094,18;;63,00;;34.308,08;
24.105; GERENCIA DE INFRAESTRUCTURAS Y EQUIPAMIENTOS DE CULTURA;5.478,30;4.000,00;4,00;;99.359,62;50,00;27,00;;108.918,92;
24.107; INSTITUTO NACIONAL DE LAS ARTES ESC텙ICAS Y DE LA MＣICA;55.645,65;56.294,93;83,48;54.910,81;8.037,98;7.551,00;431,72;;182.955,57;
26;MINISTERIO DE SANIDAD;2.930,47;1.107,12;;2.126,62;267,55;;25,00;;6.456,76;
26.105; ORGANIZACI흁 NACIONAL DE TRASPLANTES;2.930,47;1.107,12;;2.126,62;267,55;;25,00;;6.456,76;
27;MINISTERIO DE ECONOM페, COMERCIO Y EMPRESA;127.105,35;33.222,90;36,91;1.328,99;39.422,71;2.312,46;267,62;;203.696,94;
27.101; INSTITUTO NACIONAL DE ESTAD펩TICA;121.426,15;29.454,40;36,31;518,58;38.793,65;2.312,46;247,62;;192.789,17;
27.102; INSTITUTO DE CONTABILIDAD Y AUDITOR페 DE CUENTAS;5.679,20;3.768,50;0,60;810,41;629,06;;20,00;;10.907,77;
28;MINISTERIO DE CIENCIA, INNOVACI흁 Y UNIVERSIDADES;122.693,28;73.030,92;1.240,06;135.765,75;130.887,03;261.331,69;400,63;450,00;725.799,36;
28.101; UNIVERSIDAD INTERNACIONAL MEN텙DEZ PELAYO;5.086,86;9.257,03;34,35;9.111,69;1.144,13;;15,13;;24.649,19;
28.102; SERVICIO ESPA헲L PARA LA INTERNACIONALIZACI흁 DE LA EDUCACI흁;7.624,87;5.526,74;5,35;40.203,64;616,29;;16,50;;53.993,39;
28.103; CENTRO DE INVESTIGACIONES ENERG텞ICAS, MEDIOAMBIENTALES Y TECNOL휺ICAS;59.677,91;27.025,51;1.139,36;554,20;53.507,36;2.225,65;128,00;450,00;144.707,99;
28.104; AGENCIA NACIONAL DE EVALUACI흁 DE LA CALIDAD Y ACREDITACI흁;5.074,41;6.566,23;1,00;;1.220,00;;15,00;;12.876,64;
28.107; INSTITUTO DE SALUD CARLOS III;45.229,23;24.655,41;60,00;85.896,22;74.399,25;259.106,04;226,00;;489.572,15;
29;MINISTERIO DE DERECHOS SOCIALES, CONSUMO Y AGENDA 2030;11.653,58;5.722,29;5,00;8.778,91;3.226,22;200,00;36,51;;29.622,51;
29.101; AGENCIA ESPA헲LA DE SEGURIDAD ALIMENTARIA Y NUTRICI흁;10.990,30;5.350,37;5,00;;3.168,72;;30,00;;19.544,39;
29.102; REAL PATRONATO SOBRE DISCAPACIDAD;663,28;371,92;;8.778,91;57,50;200,00;6,51;;10.078,12;
30;MINISTERIO DE IGUALDAD;6.353,48;10.250,07;;7.629,00;3.154,75;100,00;23,71;;27.511,01;
30.101; INSTITUTO DE LAS MUJERES;6.353,48;10.250,07;;7.629,00;3.154,75;100,00;23,71;;27.511,01;
31;MINISTERIO DE JUVENTUD E INFANCIA;9.421,25;8.519,20;26,00;36.032,97;197,22;50,00;29,95;;54.276,59;
31.101; INSTITUTO DE LA JUVENTUD;9.421,25;8.519,20;26,00;36.032,97;197,22;50,00;29,95;;54.276,59;
33;MINISTERIO PARA LA TRANSFORMACI흁 DIGITAL Y DE LA FUNCI흁 P２LICA;54.702,35;1.223.386,91;137,85;770.437,77;8.519,81;;230,30;;2.057.414,99;
33.101; INSTITUTO NACIONAL DE ADMINISTRACI흁 P２LICA;23.166,33;27.520,46;0,82;63.616,43;4.144,49;;50,00;;118.498,53;
33.102; MUTUALIDAD GENERAL DE FUNCIONARIOS CIVILES DEL ESTADO;31.536,02;1.195.866,45;137,03;706.821,34;4.375,32;;180,30;;1.938.916,46;
;TOTAL;2.086.756,64;3.142.464,70;6.975,68;36.211.441,42;1.402.942,61;2.314.548,59;7.243,77;36.289,60;45.208.663,01;
;;



